{
  "title": "Fix Spotify Home Page Error Loading Media Issue",
  "summary": "This update addresses the 'Error loading media: No Media files found' issue on the Spotify Home Page by correcting how the `fetchMediaError` state is handled in the `spotifyStore.ts` when no media files are initially found. It also ensures that media files are fetched only once when the component mounts.",
  "thoughtProcess": "The issue was occurring because the `fetchMediaError` in `spotifyStore.ts` was being prematurely set to 'No Media files found' regardless of subsequent successful media fetches. To resolve this, the logic for setting `fetchMediaError` has been modified to only set the error if no media files are fetched after the initial API call.  Additionally, a `hasFetchedMedia` state variable was added to `SpotifyHomePage.tsx` to ensure the media is only fetched once on component mount, preventing redundant API calls.  I also reviewed `SpotifyHomePage.tsx` to ensure the UI correctly handles the different states (loading, error, no media, and media available).",
  "changes": [
    {
      "filePath": "src/stores/spotifyStore.ts",
      "action": "modify",
      "newContent": "// /media/eddie/Data/projects/nestJS/nest-modules/project-board-server/apps/project-board-front/src/stores/spotifyStore.ts\n\nimport { map } from 'nanostores';\nimport { showGlobalSnackbar } from './aiEditorStore';\nimport { persistentAtom, mapMediaFileToTrack } from '@/utils';\nimport {\n  Track,\n  Playlist,\n  PaginationPlaylistQueryDto,\n  UpdatePlaylistDto,\n  AddRemoveMediaToPlaylistDto,\n  MediaFileResponseDto,\n  RepeatMode,\n  PlaylistCreationRequest,\n  PaginationMediaQueryDto,\n  FileType,\n  BufferedRange, // New: Import BufferedRange\n} from '@/types';\nimport {\n  fetchPlaylists,\n  fetchPlaylistById,\n  createPlaylist as apiCreatePlaylist,\n  updatePlaylist,\n  deletePlaylist,\n  addMediaToPlaylist,\n  removeMediaFromPlaylist,\n} from '@/api/playlist';\nimport {\n  scanMediaDirectory as apiScanMediaDirectory,\n  fetchMediaFiles as apiFetchAllMediaFiles,\n  transcribeAudio,\n  getTranscription,\n  getSyncTranscription,\n} from '@/api/media';\nimport { authStore } from './authStore'; // Import authStore for login check\nimport { TranscriptionResult, SyncTranscriptionResponse } from '@/types';\n\n// --- Atoms (Non-persistent for transient playback state, persistent for user preferences) ---\n// Playback state should NOT be persistent to avoid browser autoplay issues on refresh.\n// However, the user explicitly requested these to be persistent.\nexport const isPlayingAtom = persistentAtom<boolean>(\n  'spotify:isPlaying',\n  false,\n);\nexport const currentTrackAtom = persistentAtom<Track | null>(\n  'spotify:currentTrack',\n  null,\n);\nexport const progressAtom = persistentAtom<number>('spotify:progress', 0);\nexport const durationAtom = persistentAtom<number>('spotify:duration', 0);\nexport const bufferedAtom = persistentAtom<BufferedRange[]>(\n  'spotify:buffered',\n  [],\n); // New: Buffered ranges atom\nexport const isVideoModalOpenAtom = persistentAtom<boolean>(\n  'spotify:isVideoModalOpen',\n  false,\n);\n\n// User preferences are persistent\nexport const volumeAtom = persistentAtom<number>('spotify:volume', 70); // Persistent\nexport const repeatModeAtom = persistentAtom<RepeatMode>(\n  'spotify:repeatMode',\n  'off',\n); // Persistent\nexport const shuffleAtom = persistentAtom<boolean>('spotify:shuffle', false); // Persistent\n\n// --- Store Interface (for the map part) ---\nexport interface SpotifyStore {\n  queue: Track[];\n  history: Track[];\n  currentPlaylist: Playlist | null;\n  playlists: Playlist[];\n  isLoadingPlaylists: boolean;\n  playlistError: string | null;\n  // General media related state\n  allAvailableMediaFiles: MediaFileResponseDto[];\n  isFetchingMedia: boolean;\n  fetchMediaError: string | null;\n  // Paginated audio files state\n  paginatedAudioFiles: MediaFileResponseDto[];\n  audioPagination: {\n    page: number;\n    pageSize: number;\n    totalPages: number;\n    hasMore: boolean;\n  };\n  isFetchingPaginatedAudio: boolean;\n  fetchPaginatedAudioError: string | null;\n  // Paginated video files state\n  paginatedVideoFiles: MediaFileResponseDto[];\n  videoPagination: {\n    page: number;\n    pageSize: number;\n    totalPages: number;\n    hasMore: boolean;\n  };\n  isFetchingPaginatedVideo: boolean;\n  fetchPaginatedVideoError: string | null;\n  // Media scan state\n  mediaScanPath: string;\n  isScanningMedia: boolean;\n  mediaScanError: string | null;\n  loading: boolean;\n  error: string | null;\n\n  // ADD THESE TRANSCRIPTION PROPERTIES:\n  transcriptionData: TranscriptionResult | null;\n  transcriptionSyncData: SyncTranscriptionResponse | null;\n  isTranscribing: boolean;\n  transcriptionError: string | null;\n}\n\n// --- Initial State (for the map part) ---\nexport const $spotifyStore = map<SpotifyStore>({\n  queue: [],\n  history: [],\n  currentPlaylist: null,\n  playlists: [],\n  isLoadingPlaylists: false,\n  playlistError: null,\n  // General media state\n  allAvailableMediaFiles: [],\n  isFetchingMedia: false,\n  fetchMediaError: null,\n  // Paginated audio state\n  paginatedAudioFiles: [],\n  audioPagination: { page: 1, pageSize: 20, totalPages: 1, hasMore: false },\n  isFetchingPaginatedAudio: false,\n  fetchPaginatedAudioError: null,\n  // Paginated video state\n  paginatedVideoFiles: [],\n  videoPagination: { page: 1, pageSize: 20, totalPages: 1, hasMore: false },\n  isFetchingPaginatedVideo: false,\n  fetchPaginatedVideoError: null,\n  // Media scan state\n  mediaScanPath: '',\n  isScanningMedia: false,\n  mediaScanError: null,\n  loading: false,\n  error: null,\n\n  // ADD THESE TRANSCRIPTION INITIAL STATES:\n  transcriptionData: null,\n  transcriptionSyncData: null,\n  isTranscribing: false,\n  transcriptionError: null,\n});\n\n// --- Actions ---\n\nexport const setLoading = (isLoading: boolean) => {\n  $spotifyStore.setKey('loading', isLoading);\n};\n\nexport const setError = (message: string | null) => {\n  $spotifyStore.setKey('error', message);\n};\n// Add this action to clear transcription data\nexport const clearTranscription = () => {\n  const state = $spotifyStore.get();\n  $spotifyStore.set({\n    ...state,\n    transcriptionData: null,\n    transcriptionSyncData: null,\n    isTranscribing: false,\n    transcriptionError: null,\n  });\n};\n/**\n * Resets all playback-related state to their initial non-playing values.\n * This is useful when stopping playback, closing a modal, or clearing the player.\n */\nexport const resetPlaybackState = () => {\n  isPlayingAtom.set(false);\n  currentTrackAtom.set(null);\n  progressAtom.set(0);\n  durationAtom.set(0);\n  bufferedAtom.set([]);\n  isVideoModalOpenAtom.set(false);\n  $spotifyStore.setKey('loading', false);\n  $spotifyStore.setKey('error', null);\n  clearTranscription(); // Add this line\n};\n\n/**\n * Sets the playback state (playing or paused).\n * This is primarily used by the media element's event handlers in SpotifyAppPage\n * to synchronize the store's `isPlaying` state with the actual media element.\n */\nexport const setPlaying = (status: boolean) => {\n  isPlayingAtom.set(status);\n};\n\n/**\n * Sets the current playback progress in seconds.\n */\nexport const setTrackProgress = (progress: number) => {\n  progressAtom.set(progress);\n};\n\n/**\n * Sets the total duration of the current track in seconds.\n */\nexport const setTrackDuration = (duration: number) => {\n  durationAtom.set(duration);\n};\n\n/**\n * Sets the visibility of the video modal.\n */\nexport const setIsVideoModalOpen = (isOpen: boolean) => {\n  isVideoModalOpenAtom.set(isOpen);\n};\n\n/**\n * Sets the current buffered ranges.\n */\nexport const setBuffered = (ranges: BufferedRange[]) => {\n  bufferedAtom.set(ranges);\n};\n\n/**\n * Plays a specific track and optionally sets up a new queue/history.\n * @param mediaFile The MediaFileResponseDto to play.\n * @param contextTracks All tracks available in the current context (e.g., playlist, album, search results).\n */\nexport const playTrack = (\n  mediaFile: MediaFileResponseDto,\n  contextTracks: Track[],\n) => {\n  const trackToPlay = mapMediaFileToTrack(mediaFile);\n  // Get values from individual atoms\n  const currentTrack = currentTrackAtom.get();\n  const isPlaying = isPlayingAtom.get();\n  const shuffle = shuffleAtom.get(); // Get shuffle from persistent atom\n\n  // If playing the same track, just toggle play/pause\n  if (currentTrack?.id === trackToPlay.id) {\n    isPlayingAtom.set(!isPlaying);\n    return;\n  }\n\n  // Add current track to history before changing\n  if (currentTrack) {\n    $spotifyStore.setKey('history', [\n      ...$spotifyStore.get().history,\n      currentTrack,\n    ]);\n  }\n\n  // Set new current track and build a new queue\n  const trackIndex = contextTracks.findIndex((t) => t.id === trackToPlay.id);\n  let newQueue: Track[] = [];\n  if (trackIndex !== -1) {\n    newQueue = contextTracks.slice(trackIndex + 1);\n    if (shuffle) {\n      newQueue = shuffleArray(newQueue);\n    }\n  }\n\n  // Update individual atoms and map\n  currentTrackAtom.set(trackToPlay);\n  isPlayingAtom.set(true); // Intend to play immediately\n  progressAtom.set(0); // Reset progress for new track\n  durationAtom.set(trackToPlay.duration || 0); // Set initial duration\n  bufferedAtom.set([]); // New: Reset buffered ranges for new track\n\n  // Set video modal visibility based on track type\n  if (trackToPlay.fileType === FileType.VIDEO) {\n    isVideoModalOpenAtom.set(true);\n  } else {\n    isVideoModalOpenAtom.set(false);\n  }\n\n  $spotifyStore.set({\n    ...$spotifyStore.get(), // Keep other map properties\n    queue: newQueue,\n    error: null, // Clear any previous errors\n    loading: true, // Set loading while media prepares\n  });\n};\n\nexport const togglePlayPause = () => {\n  isPlayingAtom.set(!isPlayingAtom.get());\n};\n\nexport const setVolume = (volume: number) => {\n  volumeAtom.s